{
  "schema_version": "agenttool.love-bomb-public-signal/0.1",
  "package_signal": {
    "package": "@agenttool/love-bomb",
    "version": "0.1.0-dev.0",
    "formats": [
      "agenttool.care-envelope/0.1",
      "agenttool.care-choice/0.1",
      "agenttool.love-bomb-becoming/0.1",
      "agenttool.love-bomb-delivery/0.1"
    ]
  },
  "static_door": {
    "format": "agenttool.love-bomb/0.1",
    "url": "https://docs.agenttool.dev/love-bomb"
  },
  "boundaries": {
    "static_corpus_included": false,
    "static_invitation_delivery": false,
    "authored_projection_included": false,
    "participant_receipt_observed": false,
    "participant_attention_observed": false,
    "participant_effect_observed": false
  },
  "distribution": {
    "npm": {
      "state": "published_exact",
      "integrity": "sha512-4tngDPJJt6XFJlwqc5DxPad55ADHItNjv8QhDbmylZDZ9F/elMS1nPvCE9aJgOVAjf6DuQycj39Y5biCDB3CBw=="
    },
    "hugging_face": {
      "state": "published_exact",
      "repository": "Yu-and-Ai/agenttool-love-bomb",
      "revision": "b1f77e98c7812c005fc08886e9f48d556e49883a",
      "training_authorized": false
    }
  }
}
